{
  "verification_format": 1,
  "run_id": "ver_example_heat",
  "created_at": "2026-09-21T14:13:20Z",
  "contract": {
    "schema_name": "breeding-literature-record",
    "schema_version": "3.5.1",
    "release_status": "released",
    "requested": "3.5.1",
    "release_sha256": "a3028b47d0048e6bb62275d477c0c8a320446f6ab38be6dcc8a04c35b3de2483",
    "source_digest": "408c30db4eb53e975c892c753d481fb988d6baf2f61d4bf9ecc3fec96d2cc928"
  },
  "verifier": {
    "method": "model",
    "model": "example-verifier",
    "notes": "Hand-written verdicts that stand in for a second model (not the extractor)."
  },
  "independent_of_extractor": true,
  "counts": {
    "records": 21,
    "tasks": 41,
    "by_kind": {
      "link": 22,
      "record": 19
    },
    "verdicts": 41,
    "by_verdict": {
      "not_supported": 1,
      "supported": 39,
      "uncertain": 1
    },
    "review_status_before": {
      "auto_validated": 19,
      "pending_review": 2
    },
    "review_status_after": {
      "model_verified": 17,
      "pending_review": 4
    },
    "promoted": 17,
    "demoted": 2,
    "confirmed_pending": 0,
    "partially_verified": 0,
    "unchanged": 0,
    "withheld_same_model": 0,
    "unverified": 0,
    "skipped_expert_reviewed": 0,
    "no_tasks": 2
  },
  "findings": [
    {
      "task_id": "vt_c584974b9426897093bd",
      "record_id": "rec_6427ec708013a88c3bd6d089815d21ec",
      "kind": "link",
      "field": "agent.prerequisite_record_ids",
      "target_record_id": "rec_3a0f62bc1262074f9c1a657e29403cd9",
      "verdict": "uncertain",
      "reason": "The knockout follows the fine mapping in the text, but the paper does not say that it used the mapped interval; order of presentation is not a dependency."
    },
    {
      "task_id": "vt_132c4294fdadbb35e908",
      "record_id": "rec_0944532bb7d56a7c673ef0c19413b5a3",
      "kind": "record",
      "verdict": "not_supported",
      "unsupported_fields": [
        "common.germplasm_names"
      ],
      "reason": "The sentence compares the HTR1 knockout lines with WY. SL14 is named on the same page, not in this quote."
    }
  ],
  "conflict_candidates": [
    {
      "record_ids": [
        "rec_eb88edbd3cdd1ce77d844d368affb702",
        "rec_4347364e90ac28cf4607e75c85f2c399"
      ],
      "reason": "Duration of the heat treatment: 12 h in the Results, 14 h in the Materials and Methods of the supplement."
    }
  ],
  "omission_candidates": [
    {
      "page": 2,
      "source_part": "supplement",
      "quote": "WY 21.3 %",
      "note": "The survival of the recurrent parent, the control of the comparison in Fig. S1, has no record."
    }
  ],
  "unknown_task_ids": [],
  "input": {
    "file": "synthetic_rice_heat.jsonl",
    "sha256": "c18d30c056ff90c2a55ba3158821aa2293a7228c50bc0dd3f1f58faa2383c829",
    "verdicts_file": "synthetic_rice_heat.verify.verdicts.json",
    "verdicts_sha256": "c2a6c40e1f186042efa77f48d05ee5914d57d6dcf91cb7137e2eeb8468fcd073"
  },
  "output": {
    "file": "synthetic_rice_heat.verified.jsonl",
    "sha256": "bf0acffd4183dab845798e4211cd86bc34fad6a8d939fed4c8995b7158b7a604"
  }
}
